{
  "architecture_base_commit": "87d066eb16d7fe0b6a1677ea7739c5c2ead4ad94",
  "artifact_type": "TERMINAL_SUPERVISOR_PUBLIC_TRUST_ROOT",
  "blocker_commit": "8ec5697b3c6fd9d93b972113b7e79d033b4cb1f6",
  "certificate": {
    "der_base64": "MIIELTCCApWgAwIBAgIQIEiKyxSwAoZG4SOq8Z/WAzANBgkqhkiG9w0BAQsFADA5MTcwNQYDVQQDDC5SYW5kbGUgQUkgVGVybWluYWwgQXV0aG9yaXR5IEluZnJhc3RydWN0dXJlIHYxMB4XDTI2MDcyMzEzNTMyNloXDTI4MDcyMzEzNTgyNlowOTE3MDUGA1UEAwwuUmFuZGxlIEFJIFRlcm1pbmFsIEF1dGhvcml0eSBJbmZyYXN0cnVjdHVyZSB2MTCCAaIwDQYJKoZIhvcNAQEBBQADggGPADCCAYoCggGBAPBDg7dAbBqzJ+ijtn6fbQrulcgzTZumbAcBecHo7p7oTJ6p7K7kygT0JaPK8B1xr7S6ZTzbeUlV/EWPhlaaWTol0Fr+NLoYXS9szI8ZSrmEA+eYvGcV/4a+YaFSbkTMA/R1U1fjMJ06Co2eI2DAQHyd4y8Fit+hrzJ6DZy9lphkxP4ZV5a2WP6YuI0QWCua4zUM6lGmEzQn6slJ8hspDrsSV5RnTYws/MORPc1HfQf4unAx3tCJqexCpeq3/q0Z18kFAg3cBoNhgrkaaERKJtXNE9op7cMRTDTt2zBztLHDu5CjTXu6pToy4fSDxtEkqaLm2xoiveST7gJ6V8+CW1O5OPHCciMkml9s/gMYeRDTkVoSJ9T9XfN/LJT+k+2N/tQFrjicYIWxMhckcS+ixHbjmBCAx1BEf+7/ZvVLsXZ7o37Jc8AqQ60gpyuIq4Z6mUll1TrTjPRQOE0UsfnYrUo2E0Cw4/r1ix8mgV6gdlalMLzoclE5RWvD8EAUYTJbjQIDAQABozEwLzAOBgNVHQ8BAf8EBAMCB4AwHQYDVR0OBBYEFP21+KPyuOSS6LA6YbUetShRGKplMA0GCSqGSIb3DQEBCwUAA4IBgQDTcMUot+TfQRdlVCqgwZFLbvYwBoDOA8vK+p4UgCs/LUSl2vOAd2OZrWUtt8ou+RaUvoGQv5ksGf1PxIP8smqZM/cus8okKKL/shwVKAoS+8fcLQZB+sVh+RVJ0OSWr5h4PEwU6NGr5NTMZfFbKFCeElWroGaXnsn/gf5UaC8LYO2Z0TDBhVNndySlTgUrTtAbD+f+CMsV3nBOwq5T8m3UW24XoyhX2RAGyK2CQGu8w/oPkgfGpGqTbR/ZtWsRmkKNmCXzhf2qEV49XL6ul6HKxmu+/pAhyLhui9CewLZ6XCx1kSnbj+fRoJrH9HByrYFkbP1LFJ3iW5V9SRYxE9srBEM1nGnpSUOPixqiNp8MkcgedoljO78CF3XRUvqVOHluKANMHYaJbPbao7s8FImUp6FeyF4/K66fNLamDXF/+l+wu0UuNLUYLZszCJXpgeE82K4vj7wvhnXqHa8IR5LhhO1Yq6UT/DVJr4HfAykJhoMnUObPXwlHXPfFqCDbKgE=",
    "der_sha256": "b84a4de14577580c64ff5b2446f120aa6f9ea60faa2cb5465b495282f0273285",
    "issuer": "CN=Randle AI Terminal Authority Infrastructure v1",
    "not_after": "2028-07-23T13:58:26Z",
    "not_before": "2026-07-23T13:53:26Z",
    "serial_number": "20488acb14b0028646e123aaf19fd603",
    "subject": "CN=Randle AI Terminal Authority Infrastructure v1",
    "thumbprint_sha1": "21961cfc1b10824e539172fd04efa83ad2be9203"
  },
  "incomplete_result_commit": "06c6805ed52a0d539a73088c097c60dec335462a",
  "key_authority": {
    "algorithm": "RSA-3072-PSS-SHA256",
    "container_unique_name": "1c9681c0b04a3dd4843d8cb457b92413_c5338977-c52f-4ca7-af6f-db9b5e287cca",
    "export_policy": "NONEXPORTABLE",
    "machine_scoped": true,
    "private_authority_in_repository": false,
    "provider": "Microsoft Software Key Storage Provider",
    "service_private_key_use_only": true,
    "size_bits": 3072
  },
  "policy": {
    "allowed_operations": [
      "GET_HEALTH",
      "GET_LEDGER_STATUS",
      "GET_PUBLIC_TRUST",
      "ISSUE_PROVISIONING_ATTESTATION",
      "ISSUE_PROVISIONING_NONCE",
      "SELF_TEST_UNAUTHORIZED_PRINCIPAL"
    ],
    "generic_signing_forbidden": true,
    "host_policy_sha256": "675a9fa9c761b2738e6b7115366eaf8bb001f6f9ff1f3fb598db2f68ad57fc19",
    "interface_version": "1.0.0",
    "ledger_id": "899e4db2b5c0f4ad58a09c682324a2ee9e5d7e2f180822ce9300922e56741d52",
    "pipe_name": "RandleAI.TerminalAuthority.v1",
    "service_name": "RandleTerminalAuthority"
  },
  "revocation_status": "NOT_REVOKED_AS_OF_PROVISIONING",
  "schema_version": "1.0.0",
  "service_principal": {
    "account": "NT SERVICE\\RandleTerminalAuthority",
    "repository_write_access": false,
    "service_sid": "S-1-5-80-1950096479-1020125124-2173088643-1633316353-879035948",
    "service_sid_type": "RESTRICTED"
  },
  "threat_boundary": {
    "excluded": [
      "deliberate UAC elevation or hostile local-administrator takeover",
      "kernel compromise",
      "offline disk or registry takeover by a separately privileged administrator"
    ],
    "resisted": [
      "hostile Python or native user-mode code under the normal filtered interactive token",
      "replacement of clients, classes, callbacks, functions, code objects, globals, modules, mappings, and worktrees",
      "caller-selected state, ledger, cache, evidence, and worktree roots",
      "direct normal-user key use, signing, ledger append, file replacement, and replay",
      "service restart and ordinary process concurrency"
    ],
    "threat_model": "FILTERED_INTERACTIVE_USER_HOSTILE_ELEVATED_ADMIN_AND_KERNEL_OUT_OF_SCOPE"
  },
  "valid_from": "2026-07-23T13:53:26Z",
  "valid_until": "2028-07-23T13:58:26Z"
}
